{
  "$schema":"storage.volume.v1.schema.json","schemaVersion":6,"collectorId":"storage.volume","collectorVersion":1,
  "displayName":"SQL Server target-host volume capacity","operationalMode":"passive",
  "dependsOn":["capability.connection","engine.core","database.files"],
  "supportedTargets":{"product":"Microsoft SQL Server","minimumMajorVersion":15,"maximumMajorVersion":17,"platforms":["Windows"],"engineEditions":[2,3,4]},
  "requiredCapabilities":["connection.tds","authentication.windows-integrated","transport.tls-validated","privilege.non-sysadmin","platform.windows"],
  "requiredPermissionsByMajor":{"15":["server.view-state","server.view-any-definition"],"16":["server.view-performance-state","server.view-any-definition"],"17":["server.view-performance-state","server.view-any-definition"]},
  "cadence":{"defaultIntervalSeconds":300,"minimumIntervalSeconds":60,"nonOverlappingPerTarget":true},
  "executionBounds":{"connectTimeoutSeconds":5,"commandTimeoutSeconds":5,"maximumRows":1000,"maximumResponseBytes":4194304},"estimatedCostClass":"moderate",
  "queryResource":"storage.volume.sqlserver15-17-windows.v1.sql","fallback":{"mode":"unsupported"},"outputSchemaVersion":1,"outputKind":"sql_volumes",
  "defaultEnabled":false
}
